{
  "schemaVersion": 1,
  "snapshotId": "synthetic-tw-label-guidance-v1",
  "sourceId": "synthetic-tw-label-guidance",
  "state": "HASH_VERIFIED",
  "artifactKind": "TEXT",
  "jurisdiction": "TW",
  "canonicalUrl": "repo://synthetic/taiwan-label-guidance",
  "retrievalUrl": null,
  "capturedAtIsoDate": "2026-08-15",
  "sourceModifiedAtIsoDate": "2026-08-15",
  "effectiveFromIsoDate": null,
  "effectiveUntilIsoDate": null,
  "mediaType": "text/plain; charset=utf-8",
  "byteLength": 254,
  "sha256": "a3a3f239d2c7b1328e84106438bebba97f678587e031f14b42b67d827bebdea4",
  "archiveUri": "repo://data/taiwan-supplement/source-snapshots/synthetic-labeling-guidance-v1.txt#sha256=a3a3f239d2c7b1328e84106438bebba97f678587e031f14b42b67d827bebdea4",
  "licenseId": "REPOSITORY_SYNTHETIC",
  "attributionText": "Repository-authored synthetic fixture",
  "redistributable": true,
  "synthetic": true,
  "legalReviewRef": null,
  "productionUse": "TEST_ONLY",
  "modelGenerated": false,
  "note": "Synthetic fixture used only to verify content-addressed capture and exact mapping behavior. It is not law, regulator guidance, or a real product label."
}
